title,date
"인스웨이브, 일본 법인 설립으로 글로벌 DX 본격화",2025.3.15
"KT, ‘창업도약패키지’ 협업 스타트업 모집",2025.3.15
"네이버 D2SF, 'AI 자율주행' 웨어러블에이아이에 투자",2025.3.15
"S2W, 롯데멤버스에 생성 AI 플랫폼 ‘SAIP’ 공급",2025.3.15
"레노버 ""5차 산업 핵심은 ‘AI에 맞는’ 데이터 관리…모든 디바이스에 AI 지원”",2025.3.15
"MS, 첫 양자 칩 공개...""몇년 내 양자 컴퓨터 상용화""",2025.3.15
"프렌들리AI, 보안 우려 없이 딥시크 사용 가능한 '서버리스 API' 국내 첫 출시",2025.3.15
[2월19일] 대세가 된 '딥 리서치'...AI 검색의 미래 될까,2025.3.15
넘어지자 바로 일어서는 축구 로봇,2025.3.15
"“국내서 딥시크 기대하려면, 정부 R&D 투자 늘려야”",2025.3.15
"“오픈AI ‘딥 리서치’, 인간 일자리 대체하는 최초의 AI 될 수 있어”",2025.3.15
"""그록-3, 가장 똑똑한 모델이지만 오픈AI가 여전히 앞설 수 있어""",2025.3.15
"GPU 20만장 투입한 '그록-3'...""투자 비해 성능 향상 적어""",2025.3.15
"메타, AI 전문 컨퍼런스 '라마콘' 신설…'라마 4' 4월29일 공개하나",2025.3.15
"빌 게이츠 ""옛날에 유일한 걱정은 핵전쟁이었는데, 이제는 4가지로 늘어""",2025.3.15
"LLM으로 LLM 탈옥 유도하는 방법 등장...""약점 가장 잘 알아""",2025.3.15
"무라티, AI 스타트업 설립 공식 발표...오픈AI 출신 12명 포진",2025.3.15
"LLM이 실제 SW 작업으로 돈을 벌 수 있을까...오픈AI, 실험 결과 공개",2025.3.15
"오픈AI, 머스크 인수 제안에 맞서 이사회 의결권 강화안 검토",2025.3.15
"'Ai 핀' 판매·서비스 중단...휴메인, HP에 1700억에 매각",2025.3.15